{
  "$schema": "https://json-schema.org/draft/2020-12/schema",
  "type": "object",
  "properties": {
    "id": {
      "type": "string",
      "pattern": "^[a-z][a-z0-9_]*$"
    },
    "source": {
      "type": "string",
      "enum": [
        "author",
        "returned_counterexample",
        "retained_delivery"
      ]
    },
    "check": {
      "type": "string",
      "pattern": "^[a-z][a-z0-9_]*$",
      "description": "the check of checks.json this sample exercises"
    },
    "note": {
      "type": "string"
    },
    "subject": {
      "description": "the subject exactly as the check receives it after the subject builder"
    },
    "sources": {
      "description": "fragment texts by reference for quotation checks",
      "type": "object",
      "propertyNames": {
        "type": "string"
      },
      "additionalProperties": {
        "type": "string"
      }
    },
    "unread_sources": {
      "description": "sources that could not be read or exceeded max bytes",
      "type": "array",
      "items": {
        "type": "object",
        "properties": {
          "reference": {
            "type": "string",
            "maxLength": 8192,
            "pattern": "^(?:src:[0-9a-f]{64}(?:\\/[a-z][a-z0-9_.-]{0,63}@(?:0|[1-9][0-9]{0,8})\\/(?:[^%/:\\u0000-\\u0020\\u007F-\\u00A0\\u00AD\\u0600-\\u0605\\u061C\\u06DD\\u070F\\u0890-\\u0891\\u08E2\\u1680\\u180E\\u2000-\\u200F\\u2028-\\u202F\\u205F-\\u2064\\u2066-\\u206F\\u3000\\uFEFF\\uFFF9-\\uFFFB]|%[0-9A-F]{2})+(?:\\/(?:[^%/:\\u0000-\\u0020\\u007F-\\u00A0\\u00AD\\u0600-\\u0605\\u061C\\u06DD\\u070F\\u0890-\\u0891\\u08E2\\u1680\\u180E\\u2000-\\u200F\\u2028-\\u202F\\u205F-\\u2064\\u2066-\\u206F\\u3000\\uFEFF\\uFFF9-\\uFFFB]|%[0-9A-F]{2})+)*(?::(?:0|[1-9][0-9]{0,15})-(?:0|[1-9][0-9]{0,15}))?)?|tree:[0-9a-f]{64}\\/(?:(?:[^%/@\\u0000-\\u0020\\u007F-\\u00A0\\u00AD\\u0600-\\u0605\\u061C\\u06DD\\u070F\\u0890-\\u0891\\u08E2\\u1680\\u180E\\u2000-\\u200F\\u2028-\\u202F\\u205F-\\u2064\\u2066-\\u206F\\u3000\\uFEFF\\uFFF9-\\uFFFB]|%[0-9A-F]{2})+(?:\\/(?:[^%/@\\u0000-\\u0020\\u007F-\\u00A0\\u00AD\\u0600-\\u0605\\u061C\\u06DD\\u070F\\u0890-\\u0891\\u08E2\\u1680\\u180E\\u2000-\\u200F\\u2028-\\u202F\\u205F-\\u2064\\u2066-\\u206F\\u3000\\uFEFF\\uFFF9-\\uFFFB]|%[0-9A-F]{2})+)*)?(?:@[0-9a-f]{64})?|entry:[0-9a-f]{64}|rec:[0-9a-f]{64}(?:#(?:\\/(?:[^%~/#\\u0000-\\u0020\\u007F-\\u00A0\\u00AD\\u0600-\\u0605\\u061C\\u06DD\\u070F\\u0890-\\u0891\\u08E2\\u1680\\u180E\\u2000-\\u200F\\u2028-\\u202F\\u205F-\\u2064\\u2066-\\u206F\\u3000\\uFEFF\\uFFF9-\\uFFFB]|%[0-9A-F]{2}|~[01])*)+)?)$"
          },
          "reason": {
            "type": "string",
            "minLength": 1
          },
          "external": {
            "description": "external object identity when the bound source had one",
            "type": "string",
            "maxLength": 8192,
            "pattern": "^[a-z][a-z0-9-]*:[a-z][a-z0-9_-]*:[^@\\u0000-\\u0020\\u007F-\\u00A0\\u00AD\\u0600-\\u0605\\u061C\\u06DD\\u070F\\u0890-\\u0891\\u08E2\\u1680\\u180E\\u2000-\\u200F\\u2028-\\u202F\\u205F-\\u2064\\u2066-\\u206F\\u3000\\uFEFF\\uFFF9-\\uFFFB]+(?:@[^\\u0000-\\u0020\\u007F-\\u00A0\\u00AD\\u0600-\\u0605\\u061C\\u06DD\\u070F\\u0890-\\u0891\\u08E2\\u1680\\u180E\\u2000-\\u200F\\u2028-\\u202F\\u205F-\\u2064\\u2066-\\u206F\\u3000\\uFEFF\\uFFF9-\\uFFFB]+)?$"
          },
          "slot": {
            "description": "input slot when the bound source had one",
            "type": "string"
          }
        },
        "required": [
          "reference",
          "reason"
        ],
        "additionalProperties": false
      }
    },
    "catalog": {
      "description": "catalog entries the check consults (catalog@1 spec of hub/rules)"
    },
    "expect": {
      "type": "array",
      "items": {
        "type": "object",
        "properties": {
          "verdict": {
            "type": "string",
            "enum": [
              "support",
              "refute",
              "unknown",
              "abstain"
            ]
          },
          "code": {
            "type": "string"
          },
          "reason": {
            "type": "string"
          },
          "tier": {
            "type": "string",
            "enum": [
              "blocking",
              "advisory"
            ]
          },
          "item": {
            "type": "string"
          }
        },
        "required": [
          "verdict"
        ],
        "additionalProperties": false
      }
    }
  },
  "required": [
    "id",
    "source",
    "check",
    "subject",
    "expect"
  ],
  "additionalProperties": false
}
