{
  "id": "positive_accept",
  "source": "author",
  "check": "review_form",
  "note": "合成账号确认形状",
  "subject": {
    "id": "criterion-0",
    "label": "合成声明",
    "location": "src:bbbbbbbbbbbbbbbbbbbbbbbbbbbbbbbbbbbbbbbbbbbbbbbbbbbbbbbbbbbbbbbb/json@1/p/body/criterion_changes/0",
    "fields": {
      "criterion": "src:aaaaaaaaaaaaaaaaaaaaaaaaaaaaaaaaaaaaaaaaaaaaaaaaaaaaaaaaaaaaaaaa",
      "grounds": [
        {
          "reference": "src:aaaaaaaaaaaaaaaaaaaaaaaaaaaaaaaaaaaaaaaaaaaaaaaaaaaaaaaaaaaaaaaa",
          "quote": "依据"
        }
      ]
    },
    "slots": {
      "review": [
        {
          "text": "账号确认",
          "code": "accept",
          "location": "src:bbbbbbbbbbbbbbbbbbbbbbbbbbbbbbbbbbbbbbbbbbbbbbbbbbbbbbbbbbbbbbbb/json@1/p/body/criterion_changes/0",
          "data": {
            "reason": "合成复核理由"
          },
          "quotes": [
            {
              "reference": "src:aaaaaaaaaaaaaaaaaaaaaaaaaaaaaaaaaaaaaaaaaaaaaaaaaaaaaaaaaaaaaaaa",
              "text": "依据"
            }
          ]
        }
      ]
    }
  },
  "sources": {
    "src:aaaaaaaaaaaaaaaaaaaaaaaaaaaaaaaaaaaaaaaaaaaaaaaaaaaaaaaaaaaaaaaa": "依据",
    "src:bbbbbbbbbbbbbbbbbbbbbbbbbbbbbbbbbbbbbbbbbbbbbbbbbbbbbbbbbbbbbbbb/json@1/p/body/criterion_changes/0": "合成声明"
  },
  "expect": [
    {
      "verdict": "support",
      "tier": "blocking"
    }
  ]
}
