{
  "id": "claims_agree",
  "source": "author",
  "check": "command_claims",
  "note": "复核方说存在的命令在目录里，说不存在的命令不在目录里",
  "subject": {
    "item": "sample:c1",
    "location": "src:aaaaaaaaaaaaaaaaaaaaaaaaaaaaaaaaaaaaaaaaaaaaaaaaaaaaaaaaaaaaaaaa/kityminder@1/n/c1",
    "claims": [
      {
        "command": "show pool",
        "present": true
      },
      {
        "command": "pool delete",
        "present": false
      }
    ]
  },
  "catalog": {
    "root": "dddddddddddddddddddddddddddddddddddddddddddddddddddddddddddddddd",
    "complete": true,
    "entries": [
      {
        "head": "pool create",
        "signatures": [
          [
            {
              "name": "name",
              "type": "string",
              "maxLength": 32
            }
          ]
        ]
      },
      {
        "head": "health interval",
        "signatures": [
          [
            {
              "name": "pool",
              "type": "string"
            },
            {
              "name": "seconds",
              "type": "int",
              "minimum": 1,
              "maximum": 300
            }
          ]
        ]
      },
      {
        "head": "show pool",
        "signatures": [
          [],
          [
            {
              "name": "name",
              "type": "string"
            }
          ]
        ]
      }
    ]
  },
  "expect": [
    {
      "verdict": "support",
      "item": "sample:c1"
    },
    {
      "verdict": "support",
      "item": "sample:c1"
    }
  ]
}
