{
  "id": "scope_frozen",
  "source": "author",
  "check": "review_scope",
  "note": "复核保留初评的整份识别范围",
  "subject": {
    "scope": {
      "schema": "case-review-scope@1",
      "source": "aaaaaaaaaaaaaaaaaaaaaaaaaaaaaaaaaaaaaaaaaaaaaaaaaaaaaaaaaaaaaaaa",
      "document": "sample",
      "parameters": {
        "case_rule": "marked",
        "case_priority": 2,
        "group_priority": 1,
        "precondition_priority": 3
      },
      "expected": [
        {
          "item": "sample:c1",
          "location": "src:aaaaaaaaaaaaaaaaaaaaaaaaaaaaaaaaaaaaaaaaaaaaaaaaaaaaaaaaaaaaaaaa/kityminder@1/n/c1"
        },
        {
          "item": "sample:c2",
          "location": "src:aaaaaaaaaaaaaaaaaaaaaaaaaaaaaaaaaaaaaaaaaaaaaaaaaaaaaaaaaaaaaaaa/kityminder@1/n/c2"
        }
      ],
      "selected": [
        "sample:c1"
      ]
    },
    "conflict": false
  },
  "sources": {
    "src:aaaaaaaaaaaaaaaaaaaaaaaaaaaaaaaaaaaaaaaaaaaaaaaaaaaaaaaaaaaaaaaa/kityminder@1/i/0": "合成根"
  },
  "expect": [
    {
      "verdict": "support",
      "tier": "blocking"
    }
  ]
}
