{
  "id": "authority_positive",
  "source": "author",
  "check": "authority",
  "subject": {
    "context": {
      "groups": [
        {
          "kind": "recompose-product@1",
          "authority": {
            "adjudication_owner": "产品包作者与集成者",
            "schema": "recompose-product@1",
            "governing": [
              {
                "kind": "spec",
                "ref": "src:f13eb55d7393200cf252623fbc638dc55d62d9c568f4ad036a478eaa6d4da5f1",
                "version": "1.0",
                "authority": "product-declared",
                "applies_to": {
                  "lines": [
                    "10.8"
                  ],
                  "all_builds": true
                },
                "constraints": [
                  {
                    "field": "orbit.mode",
                    "values": [
                      "rr",
                      "lc",
                      "hash"
                    ]
                  }
                ]
              },
              {
                "kind": "spec",
                "ref": "src:75a5dc26c47240dfedf0aa9b5bfc2e63a79f6d413498a8d29a563abcc589307c",
                "version": "1.1",
                "authority": "product-declared",
                "applies_to": {
                  "lines": [
                    "10.8"
                  ],
                  "all_builds": true
                },
                "constraints": [
                  {
                    "field": "orbit.mode",
                    "values": [
                      "rr",
                      "lc",
                      "hash",
                      "weighted"
                    ]
                  }
                ]
              }
            ],
            "declarations": [
              {
                "ref": "src:eb4aabf53cc3b789e2912c8531e8daec1e09cbd0f8a8a5dc74580a4550326ee5/json@1/p/parameters/0",
                "role": "parameter_type",
                "path": "/commands/widget/health/interval"
              }
            ],
            "parameters": [
              {
                "path": "/commands/widget/health/interval",
                "position": 1,
                "type": "int",
                "minimum": 1,
                "maximum": 60,
                "role": "asserted_value",
                "load_bearing": true
              }
            ],
            "values": [
              {
                "slot": "interval_value",
                "ref": "src:eb4aabf53cc3b789e2912c8531e8daec1e09cbd0f8a8a5dc74580a4550326ee5/json@1/p/values/0",
                "values": [
                  5
                ],
                "path": "/commands/widget/health/interval",
                "position": 1
              }
            ],
            "scope": {
              "product": "orbit",
              "product_pack_digest": "cccccccccccccccccccccccccccccccccccccccccccccccccccccccccccccccc",
              "line": "10.8",
              "build": "Rel_ORBIT_10_8_0_30",
              "root": "bbbbbbbbbbbbbbbbbbbbbbbbbbbbbbbbbbbbbbbbbbbbbbbbbbbbbbbbbbbbbbbb"
            }
          },
          "invalid": false
        }
      ]
    }
  },
  "expect": [
    {
      "verdict": "support",
      "tier": "blocking"
    }
  ]
}
