{
  "id": "in_scope_case",
  "source": "author",
  "check": "in_scope",
  "note": "合成样例：原因是后一构建的修改路径，检查给出支持",
  "subject": {
    "items": [
      {
        "id": "doc-1:n1",
        "location": "tree:eeeeeeeeeeeeeeeeeeeeeeeeeeeeeeeeeeeeeeeeeeeeeeeeeeeeeeeeeeeeeeee/commands/show@aaaaaaaaaaaaaaaaaaaaaaaaaaaaaaaaaaaaaaaaaaaaaaaaaaaaaaaaaaaaaaaa",
        "fields": {
          "document": "doc-1",
          "node": "n1",
          "priority": 1,
          "negative": false,
          "reasons": [
            {
              "change": "modified",
              "detail": 0
            }
          ]
        },
        "label": "查看部件状态"
      }
    ],
    "note": {
      "details": [
        {
          "path": "/commands/show",
          "change": "modified",
          "definition_change": "modified",
          "conclusion": "命令定义有变更",
          "differences": [],
          "references": []
        }
      ]
    }
  },
  "expect": [
    {
      "verdict": "support",
      "item": "doc-1:n1",
      "tier": "advisory"
    }
  ]
}
